{
  "_description": "Composed foundation governance bundle. Built deterministically from the 8 authoring pillars + N file-type-contracts by tools/build-foundation-master.sh. Shipped as immutable artifact to adopter ~/.claude/governance/foundation-master.json; adopters never build. Hooks load this bundle once per write-session; per-rule lookups derive from this composed view. r47_exempt_paths_composed is composed from tagging-rules.json#_rules[id=R-47].r47_exempt_paths (the `_rules[]` register location). r32_type_aliases/r32_exempt_paths/r47_tag_cap default to {}/[]/25 (gate-config dropped).",
  "_index": {
    "_description": "8-pillar registry + cross-cutting meta-rules + dissolved-schema registry. Hook-loaded. The registry spans 8 pillars (frontmatter, tagging, naming, mandatory-files, doc-dependencies, file-type-contracts, vault-writers, plans); the retired governance/enforcement-map.schema.json has canonical successor governance/foundation-master.json.",
    "_design_notes": {
      "consumer": "pre-write-guard.sh, post-write-verify.sh, librarian governance-parity-audit",
      "evolution_protocol": "R-37 atomic lockstep",
      "lockstep_pair": "System Governance/ folder narrative spokes (one per pillar)"
    },
    "_spoke_prefix": "System Governance - ",
    "cross_cutting_meta_rules": [
      {
        "category": "S1",
        "enforcement_layer": [
          "git",
          "librarian governance-parity-audit"
        ],
        "failure_mode": "Drift from partial landings of a multi-surface change. Caught at git commit-boundary + audit-time, never write-time.",
        "home": "meta-block",
        "id": "R-37",
        "name": "Atomic lockstep (documentary)",
        "rule_text": "R-37 (atomic lockstep) is DOCUMENTARY across the entire governance surface — there is NO write-time DENY, by design. A PreToolUse hook sees exactly one file per call and cannot inspect a multi-file commit set. Enforcement = git's commit-boundary atomicity + the librarian governance-parity-audit capability at session-close. The lockstep set = pillar JSON + narrative spoke + CLAUDE.md.",
        "source": "governance/_index.json :: cross_cutting_meta_rules (SoT)",
        "status": "active",
        "tier": "2"
      },
      {
        "category": "S1",
        "enforcement_layer": [
          "doc",
          "librarian"
        ],
        "failure_mode": "Ossify (advisory forever) or promote without data.",
        "home": "meta-block",
        "id": "R-35",
        "name": "Stage-gated promotion framework",
        "rule_text": "Tier 1 advisory + promotion_criterion. Clean data -> promote to a blocking tier; no data -> retire. Stage-gated promotion, never ossify, never promote without data.",
        "source": "governance/_index.json :: cross_cutting_meta_rules (SoT)",
        "status": "active",
        "tier": "framework"
      },
      {
        "category": "S1",
        "enforcement_layer": [
          "doc",
          "librarian"
        ],
        "failure_mode": "Over-reach (auto-overwriting semantic content) or under-reach (failing to auto-fix mechanical drift).",
        "home": "meta-block",
        "id": "R-34",
        "name": "Self-healing boundary",
        "rule_text": "Mechanical drift auto-fixes (librarian regenerates mechanically-derivable values); semantic drift self-flags for review, never auto-overwritten.",
        "source": "governance/_index.json :: cross_cutting_meta_rules (SoT)",
        "status": "active",
        "tier": "framework"
      },
      {
        "category": "S1",
        "enforcement_layer": [
          "pre-write-guard.sh write-time DENY on shadowing writes missing `_override_reason`",
          "`--force-override` per-write escape hatch (no persistent disable)",
          "librarian governance-parity-audit `foundation-upgrade-touches-shadowed-entry` finding",
          "version-control merge-conflict surfacing on foundation upgrades touching shadowed entries"
        ],
        "failure_mode": "Silent collisions between adopter customization and foundation canonical produce unpredictable runtime behavior — rules with the same ID compete; overlay edits silently disable foundation rules.",
        "home": "meta-block",
        "id": "R-52",
        "name": "Layer-3 Overlay Collision Tiebreaker",
        "rule_text": "When adopter Layer-3 overlay and foundation canonical both declare the same rule ID or extensible entry kind: adopter Layer-3 SHADOWS foundation (adopter wins). Foundation declaration is preserved but does not fire. Adopter MUST carry `_override_reason` (free-text, mandatory) on every shadowing entry. Write-time DENY on shadowing writes without `_override_reason`; per-write `--force-override` bypass; no persistent disable.",
        "source": "governance/_index.json :: cross_cutting_meta_rules (SoT; personalization-seams audit)",
        "status": "active",
        "tier": "2"
      },
      {
        "category": "S1",
        "enforcement_layer": [
          "hooks/pre-write-guard.sh (ships with empty tripwire_paths[])"
        ],
        "failure_mode": "A write to a known-retired path lands silently. Empty tripwire_paths at ship means no-op by default.",
        "home": "meta-block",
        "id": "R-01",
        "name": "Dead-path tripwire",
        "rule_text": "Writes to a declared dead path are DENIED. Ships with an EMPTY tripwire_paths[] (no dead paths declared at v1.0.0); the mechanism is present for adopters/future use.",
        "source": "governance/_index.json :: cross_cutting_meta_rules (SoT)",
        "status": "active",
        "tier": "deny"
      },
      {
        "category": "S1",
        "enforcement_layer": [
          "hooks/pre-write-guard.sh (skill-file edit advisory checklist)"
        ],
        "failure_mode": "A skill changes without the cross-surface propagation protocol.",
        "home": "meta-block",
        "id": "R-02",
        "name": "Skill-change protocol",
        "rule_text": "Editing a skill (SKILL.md / process.sh) surfaces the change-protocol checklist (save memory, update docs, grep downstream). Advisory.",
        "source": "governance/_index.json :: cross_cutting_meta_rules (SoT)",
        "status": "active",
        "tier": "advisory"
      },
      {
        "category": "S1",
        "enforcement_layer": [
          "librarian"
        ],
        "failure_mode": "librarian-manifest.json drifts stale against the real foundation surface.",
        "home": "meta-block",
        "id": "R-43",
        "name": "librarian-manifest staleness audit",
        "rule_text": "The librarian-manifest read-replica is audited for staleness against the foundation surface. Audit-tier (librarian), not write-time.",
        "source": "governance/_index.json :: cross_cutting_meta_rules (SoT)",
        "status": "active",
        "tier": "audit"
      },
      {
        "category": "S1",
        "enforcement_layer": [
          "librarian"
        ],
        "failure_mode": "Escape hatches used routinely rather than exceptionally; governance silently eroded.",
        "home": "meta-block",
        "id": "R-46",
        "name": "Bypass/override abuse audit",
        "rule_text": "Bypass/override usage (governance escape hatches, --force flags, bypass env vars) is audited for abuse patterns. Audit-tier (librarian).",
        "source": "governance/_index.json :: cross_cutting_meta_rules (SoT)",
        "status": "active",
        "tier": "audit"
      },
      {
        "category": "C2",
        "enforcement_layer": [
          "hooks/pre-write-guard.sh (claude-mem SessionEnd protection)"
        ],
        "failure_mode": "claude-mem SessionEnd hook disabled; auto-memory silently stops persisting.",
        "home": "meta-block",
        "id": "R-24",
        "name": "Protected SessionEnd hooks",
        "rule_text": "Edits that would disable the claude-mem SessionEnd hook are DENIED (CLAUDE_MEM_DISABLE_OK=1 escape hatch). Load-bearing for auto-memory.",
        "source": "governance/_index.json :: cross_cutting_meta_rules (SoT)",
        "status": "active",
        "tier": "deny"
      },
      {
        "category": "C2",
        "enforcement_layer": [
          "hooks/stop-checkpoint-check.sh (Stop gate)",
          "hooks/prompt-context.sh (re-firing mandate band)"
        ],
        "failure_mode": "A long session compacts without a fresh checkpoint; session continuity state is lost.",
        "home": "meta-block",
        "id": "R-26",
        "name": "Checkpoint freshness gate",
        "rule_text": "At context pressure thresholds, a fresh per-session checkpoint is required; the Stop hook gates until the checkpoint is fresh (< 10 min). Safety valve preserved above the high-pressure ceiling.",
        "source": "governance/_index.json :: cross_cutting_meta_rules (SoT)",
        "status": "active",
        "tier": "gate"
      },
      {
        "category": "C2",
        "enforcement_layer": [
          "hooks/stop-drift-scan.sh (Stop advisory)"
        ],
        "failure_mode": "Files touched in a session drift from their governed shape without surfacing.",
        "home": "meta-block",
        "id": "R-36",
        "name": "Touched-file drift scan",
        "rule_text": "On Stop, touched files are scanned for drift and surfaced advisorily.",
        "source": "governance/_index.json :: cross_cutting_meta_rules (SoT)",
        "status": "active",
        "tier": "advisory"
      },
      {
        "category": "C2",
        "enforcement_layer": [
          "hooks/session-register.sh -> track-vault-write -> prompt-context.sh (default 3-hook loop)"
        ],
        "failure_mode": "The default session-wiring loop is broken or mis-ordered; coordination + context-injection degrade.",
        "home": "meta-block",
        "id": "R-42",
        "name": "Default session-register hook loop",